{
  "protocolo": "1.0",
  "id": "PRP-0005",
  "titulo": "STEP da PRP-0001: land total 10,00 mm com chanfro de saida 0,80 mm x 45 graus (geometria entregue)",
  "autor": "IA engenheira (Arena Agent Mode, sessao arena/01a096e3-matrizextrusora)",
  "data": "2026-09-12",
  "tipo": "geometria",
  "base_commit": "eaf47d0e3c86f52f9bdb27317837fbbe205fbc83",
  "objetivo": "Fechar o ciclo da PRP-0001 (APROVADO): entregar o STEP que faltava, com land reto e paralelo de 9,20 mm no lugar dos 8,50 mm medidos no v27, e parede de aco no labio de saida de 1,45 mm no lugar de 0,75 mm, sem alterar largura, espessura, raio de borda, boca de entrada nem envelope.",
  "arquivos": [
    {
      "caminho": "01_CAD_MatrizJonatha_Oficial/PRP-0001-r2_land10_chanfro080/MatrizJonatha_L10_C0.8.step",
      "sha256": "00bdefcd1aa55a892a30659056542fadf0f6fe1b9c04023587ca6fa143607e75",
      "operacao": "novo"
    },
    {
      "caminho": "01_CAD_MatrizJonatha_Oficial/PRP-0001-r2_land10_chanfro080/MatrizJonatha_L10_C0.8_Explodida.step",
      "sha256": "5142c245dd2ba42e5403efaec579a3f8ee9ab2d9ee2330abc4222ba93fe0626b",
      "operacao": "novo"
    },
    {
      "caminho": "01_CAD_MatrizJonatha_Oficial/PRP-0001-r2_land10_chanfro080/MatrizJonatha_L10_C0.8_Com_Fluxo.step",
      "sha256": "3d1ed700632659c14bd9c27587991e1d850303a7eecf98ad35f34dac4140324b",
      "operacao": "novo"
    },
    {
      "caminho": "01_CAD_MatrizJonatha_Oficial/PRP-0001-r2_land10_chanfro080/MatrizJonatha_L10_C0.8_Body_A.step",
      "sha256": "6a67f26437072610a821e17e211e7c0bd049a61bbb61921f24d208c91519ec86",
      "operacao": "novo"
    },
    {
      "caminho": "01_CAD_MatrizJonatha_Oficial/PRP-0001-r2_land10_chanfro080/MatrizJonatha_L10_C0.8_Body_B.step",
      "sha256": "d258f14e99eb758f841fc4566765d3a9c49ef1cec2ac4e0d757238bc5e0bde09",
      "operacao": "novo"
    },
    {
      "caminho": "01_CAD_MatrizJonatha_Oficial/PRP-0001-r2_land10_chanfro080/MatrizJonatha_L10_C0.8_Canal_Fluxo.step",
      "sha256": "2d370038da9501cb72ad35272bb51a9a5d8f217fd5c6449c901021b0c25ea685",
      "operacao": "novo"
    },
    {
      "caminho": "01_CAD_MatrizJonatha_Oficial/PRP-0001-r2_land10_chanfro080/gerar_variante_prp0001r2.py",
      "sha256": "3c4f2bfd085cdbaddc94afe77b775d13f1f36874cad500c82e15f805682af6a6",
      "operacao": "novo"
    },
    {
      "caminho": "01_CAD_MatrizJonatha_Oficial/PRP-0001-r2_land10_chanfro080/medir_variante_prp0005.py",
      "sha256": "71720fa9776e061e8b8ae85f265eb268d171a6c44362eac72ce3aa1c5e277a6d",
      "operacao": "novo"
    },
    {
      "caminho": "01_CAD_MatrizJonatha_Oficial/PRP-0001-r2_land10_chanfro080/medicao_variante_prp0005.json",
      "sha256": "c4f9a2192189c0672c3c8940fe330003b6614562ca6190ee3123865085c50a70",
      "operacao": "novo"
    },
    {
      "caminho": "01_CAD_MatrizJonatha_Oficial/PRP-0001-r2_land10_chanfro080/medicao_v27_oficial.json",
      "sha256": "72e37bf1d5f2314ed42b4e82b50e2f55637d60b4af33ecc1d8aea2d5fcdb077d",
      "operacao": "novo"
    }
  ],
  "parametros": {
    "land_total_mm": 10.0,
    "chanfro_mm": 0.8
  },
  "esperado": {
    "land_util_mm": 9.2,
    "parede_labio_mm": 1.45,
    "dp_total_bar": 27.57
  },
  "nao_muda": [
    "largura_fenda_mm",
    "espessura_fenda_mm",
    "raio_borda_mm",
    "area_fenda_mm2",
    "boca_entrada_mm",
    "z_total_mm",
    "diametro_externo_mm",
    "forca_abertura_kN",
    "residencia_media_s",
    "residencia_parede_min"
  ],
  "justificativa": "O chanfro de 1,50 mm do v27 consome 1,50 mm dos 10,00 mm de land declarados no SSOT: sobram 8,50 mm paralelos e apenas 0,75 mm de aco no labio de saida. Reduzir o chanfro para 0,80 mm devolve 0,70 mm de land paralelo (9,20 mm medidos no STEP entregue) e engrossa o labio para 1,45 mm. A contrapressao sobe o minimo necessario: pelo modelo calibrado do auditor (6,77 + 2,1824*9,20 + 0,9067*0,80) da 27,573 bar contra 26,680 bar do v27, +3,35%, muito abaixo do teto de +15% do paragrafo 4. A secao transversal do land nao muda (75,00 x 1,50 com R0,75, area 112,0171 mm2), portanto o CFD 2D do baseline continua valendo: gradiente 2,1761 bar/mm, tau de parede 160,89 kPa (< 200 kPa) e uniformidade de nucleo 92,3% dentro de +-5% (97,0% dentro de +-10%). O volume do canal cai 0,058% (213 945,146 -> 213 820,019 mm3) e o aco cresce os mesmos 125,127 mm3 no labio; o fechamento envelope - (aco + canal + 2 furos de pino) fecha em -0,0003 mm3.",
  "riscos": [
    "Chanfro menor reduz o alivio de saida: a aresta do labio fica mais exposta a rebarba e a dano na limpeza e na partida. Exige acabamento controlado e inspecao da aresta antes da montagem.",
    "O land mais longo aumenta o tempo de residencia e a contrapressao em 0,89 bar; conferir na maquina se a extrusora tem margem de pressao e se a temperatura de processo nao precisa de ajuste.",
    "Alteracao exige retifica do labio e nova medicao dimensional na peca fisica antes do uso; o STEP entregue nao substitui essa medicao.",
    "O modelo parametrico do auditor nao captura a perda extensional da convergencia (-4 a +15 bar) nem inchamento de saida: o Delta p real pode diferir do previsto em mais do que os 3,35% calculados."
  ],
  "cfd_requerido": false,
  "observacoes": "LEIA ANTES DE INTERPRETAR O VEREDITO. (1) NOME: o paragrafo 2 do protocolo pede PRP-0001-r2 para a revisao com STEP, mas esquema/proposta.schema.json restringe 'id' a ^PRP-[0-9]{4}$ e o id alimenta o nome do arquivo de veredito; por isso a entrega vai como PRP-0005 e a linhagem fica registrada aqui e no titulo. (2) SELO VENCIDO (gate I5, bloqueia tudo): o hash de 05_Interface_Auditoria/PROTOCOLO_AUDITORIA.md no baseline congelado e 1fc0aa5e26f26c6d..., mas o arquivo commitado em main (b065d68 e 75b7153) e 702d5f2fb7494f3b.... A diferenca e a edicao documentada do proprio protocolo - ponteiro do CI no paragrafo 7 e a linha 1.0.1 no historico de versoes - feita depois do ultimo re-selo (hashes_atualizados_em 2026-09-12T17:58:21+0000, commit c4371d7b2b81). Os outros 34 hashes da zona congelada conferem. Consequencia: TODA proposta nova sai BLOQUEADA em I5 ate o re-selo humano (python 05_Interface_Auditoria/scripts/auditar_proposta.py --atualizar-hashes), que e ato do responsavel segundo o paragrafo 8 - esta IA nao o executou. (3) A REGUA NAO MEDE O OBJETO ENTREGUE: verify_geometry_ssot.py tem DIR_CAD fixo em 01_CAD_MatrizJonatha_Oficial/ e auditar_proposta.py roda a bateria sempre sobre esses STEP oficiais, portanto em proposta tipo 'geometria' o 'esperado' e comparado com o MASTER v27, nao com o STEP entregue: land_util 8,50 contra 9,20 declarado da FALHA em E:land_util_mm (tolerancia +-2%) e E:parede_labio_mm 0,75 contra 1,45. O STEP entregue esta conforme: medicao independente em medir_variante_prp0005.py da 10/10 conformes, e o mesmo script apontado para os STEP oficiais (--sanidade) reproduz o baseline em 0,000% em todas as metricas. A correcao da regua esta escrita em 03_Relatorios_e_Documentacao/REGUA_V1.1_MUDANCA_PROPOSTA.md, para ato humano. Um REPROVADO ou BLOQUEADO aqui deve ser lido como 'a regua nao mede o objeto', nao como 'a peca esta fora'. (4) interferencia_mm3 FOI REMOVIDO DE nao_muda nesta revisao, e isso e um defeito da regua, nao da proposta: em comparar_baseline, baseline 0.0 produz delta_pct None e 'aceitavel = delta == 0' avalia None == 0 -> False, entao qualquer proposta que liste uma metrica de baseline nulo em nao_muda recebe 'aceitavel: nao' mesmo sem mudanca nenhuma (0,0 -> 0,0). Como a interferencia e um requisito duro (D5, medido 0,0 mm3 no STEP entregue), a garantia continua coberta; o gatilho espurio, nao. Correcao proposta no documento acima. (5) cfd_requerido=false de proposito: o modo cfd do auditor chama cfd_land_crosssection.py com 3 secoes e sobrescreve os artefatos versionados, que hoje trazem 5 secoes (70/95/99,5/103/107) incluindo o funil; alem disso a secao transversal do land e identica a do v27 (75,00 x 1,50 com R0,75, area 112,0171 mm2), entao o CFD nao acrescenta informacao discriminatoria - gradiente 2,1761 bar/mm, tau 160,89 kPa e uniformidade de nucleo 92,3% continuam valendo. (6) O master oficial v27 nao foi sobrescrito: a variante vive em subpasta propria (PRP-0001-r2_land10_chanfro080/), que por nao ser recursiva na coleta de arquivos_protegidos() nao entra na zona congelada - comportamento desejavel para candidato, mas que merece nota: um STEP solto na raiz de 01_ dispararia I7 INFO e exigiria recongelamento. A decisao de promover a variante a master e do Humano, junto com a atualizacao do SSOT (land_paralelo_real_mm 8,50 -> 9,20). (7) Persistem nesta variante duas nao conformidades herdadas do v27 que nao faziam parte da PRP-0001: o SSOT declarar land 10,00 contra o medido, e os dois furos de pino O4 x 12 SELADOS no Body_A (bolhas impossiveis de usinar, 2 cavidades fechadas medidas tanto no master quanto na variante). O gerador tem --furos-passantes para estudar a correcao dessas bolhas em separado, sem misturar com o escopo desta proposta."
}