{"protocolo": "1.0", "id": "PRP-0900-teste-api", "titulo": "teste da rota POST /api/auditar", "autor": "teste automatico", "data": "2026-09-12", "tipo": "calculo", "base_commit": "55860156a66f91fa7ae6e4093b5cf73eda433f96", "objetivo": "Devolver land paralelo e engrossar a parede de aco do labio, aproveitando que o chanfro e' o trecho menos util do canal.", "arquivos": [], "parametros": {"land_total_mm": 10.0, "chanfro_mm": 0.5}, "esperado": {"land_util_mm": 9.5, "parede_labio_mm": 1.75, "dp_total_bar": 27.96}, "nao_muda": ["largura_fenda_mm", "espessura_fenda_mm", "raio_borda_mm", "area_fenda_mm2", "boca_entrada_mm", "volume_canal_mm3", "uniformidade_nucleo_pct"], "justificativa": "O chanfro de saida custa 0,907 bar por mm de comprimento (gradiente medio medido no v27) e devolve pouco em troca: e' um trecho divergente, onde a secao cresce e a taxa de deformacao axial e' maxima (39 1/s). Reduzindo de 1,50 para 0,50 mm: o land paralelo vai de 8,50 para 9,50 mm (gradiente 2,187 bar/mm -> +2,19 bar) e o proprio chanfro economiza 0,91 bar, resultando em 27,96 bar contra 26,68 bar do v27 (+4,8%). Em troca, a parede de aco do labio sai de 0,75 para 1,75 mm.", "riscos": ["Chanfro de 0,50 mm exige acabamento fino no labio; qualquer rebarba fica proporcionalmente maior.", "Menos alivio de secao na saida pode dificultar a limpeza e a partida; avaliar na pratica antes de fixar o padrao."], "observacoes": "Comparar com PRP-0001 (chanfro 0,80 mm): a diferenca de pressao entre as duas e' de apenas 0,4 bar, mas a parede do labio ganha mais 0,30 mm. Decisao de fabricacao, nao de hidraulica."}