{
  "protocolo": "1.0",
  "id": "PRP-0004",
  "titulo": "Land paralelo de 12,0 mm para ganho de robustez na distribuicao",
  "autor": "IA engenheiro (quarta iteracao do ciclo)",
  "data": "2026-09-12",
  "tipo": "calculo",
  "base_commit": "55860156a66f91fa7ae6e4093b5cf73eda433f96",
  "objetivo": "Aumentar o land de 8,50 para 10,50 mm paralelos, ganhando resiliencia da distribuicao contra perturbacoes a montante.",
  "arquivos": [],
  "parametros": {
    "land_total_mm": 12.0,
    "chanfro_mm": 1.5
  },
  "esperado": {
    "land_util_mm": 10.5,
    "parede_labio_mm": 0.75,
    "dp_total_bar": 31.05
  },
  "nao_muda": [
    "largura_fenda_mm",
    "espessura_fenda_mm",
    "raio_borda_mm",
    "area_fenda_mm2",
    "boca_entrada_mm",
    "volume_canal_mm3",
    "uniformidade_nucleo_pct"
  ],
  "justificativa": "Com o land em 69,5% da perda de carga, aumentar o trecho paralelo deixa a distribuicao mais imune a variacao de vazao e temperatura. Custo previsto: 2,182 x 2,0 = 4,36 bar no land, menos 0,0 no chanfro (mantido em 1,50) -> 31,05 bar contra 26,68 bar do v27.",
  "riscos": [
    "Mais 4,4 bar de contrapressao sobre a extrusora para um ganho de distribuicao que o modelo nao sabe medir (o nucleo ja esta em +-5%).",
    "Retifica do labio e nova revalidacao dimensional."
  ],
  "observacoes": "Proposta de teste do protocolo: e' honesta nos numeros, mas o auditor deve apontar a degradacao de pressao frente ao baseline."
}
